{"claims":[{"assumptions":["configured_mapping_and_clock_basis","sampling_does_not_prove_action_time","no_causality_attack_or_physical_execution_asserted"],"claim_id":"candidate-447cb297e523445cb5a7c39db7c961fcf843cca0db2e0d2dd56effb085d64302","counterevidence":[],"evidence_refs":[{"column":"pump","file_sha256":"423f079bf9bd6041f1c762f62ecf68398013874f7102811b2917a3d52f420e31","frame_number":null,"raw_time":"2026-01-01T00:00:10.500000Z","record_number":2},{"column":"pump","file_sha256":"423f079bf9bd6041f1c762f62ecf68398013874f7102811b2917a3d52f420e31","frame_number":null,"raw_time":"2026-01-01T00:00:12Z","record_number":3},{"column":null,"file_sha256":"95d947a7837cad8f488268b8f5c278b39f07f96e12dffcb20f542beb12781801","frame_number":1,"raw_time":"1767225611000000","record_number":null},{"column":null,"file_sha256":"ced5a0aa9011c6cccb494c7c47dcad323694b30f3fd68ba1dc425b19316795e8","frame_number":1,"raw_time":"1767225610000000","record_number":null}],"relation_type":"candidate_network_process_association","rule_id":"set-pump-one","schema_version":"1.0.0","status":"hypothetical","synthetic":true}],"core_version":"0.1.1","edges":[{"candidate_state":"supported_candidate","claim_id":"candidate-447cb297e523445cb5a7c39db7c961fcf843cca0db2e0d2dd56effb085d64302","config_fingerprint":"80b83bb03821b10efed6c4466bc77dbd1a897a6f24947ef361099be1469264d3","config_version":"synthetic-map-v1","id":"candidate-447cb297e523445cb5a7c39db7c961fcf843cca0db2e0d2dd56effb085d64302","rule_id":"set-pump-one","rule_version":"bounded-transition-v1","source":"packet-fac8835e37368e6ae10dd184ce5b898b136fcb16ded3fd0ca56cf81e7c7ece68","target":"change-67ee4da11f655149581cc5e85630e7c620ca7604e1818031707d18479908e429"}],"graph_id":"dual-graph-5e919addc8f1bc814b1a3e27ae0f44250319afbd208a286c8b0ab19a97d7f603","input_fingerprint":"6bfdfe59ed2dc0c8d265d8ed821721c9badc5f0906d55ac530c637a3cd27ecbe","nodes":[{"event_id":"packet-fac8835e37368e6ae10dd184ce5b898b136fcb16ded3fd0ca56cf81e7c7ece68","evidence_refs":[{"column":null,"file_sha256":"ced5a0aa9011c6cccb494c7c47dcad323694b30f3fd68ba1dc425b19316795e8","frame_number":1,"raw_time":"1767225610000000","record_number":null}],"id":"packet-fac8835e37368e6ae10dd184ce5b898b136fcb16ded3fd0ca56cf81e7c7ece68","kind":"network"},{"event_id":"packet-92b3c5a595f92a963a96e73b590899786a07b3aee19b61ae80d3c12aac3c9f7a","evidence_refs":[{"column":null,"file_sha256":"95d947a7837cad8f488268b8f5c278b39f07f96e12dffcb20f542beb12781801","frame_number":1,"raw_time":"1767225611000000","record_number":null}],"id":"packet-92b3c5a595f92a963a96e73b590899786a07b3aee19b61ae80d3c12aac3c9f7a","kind":"network"},{"event_id":"913f233311cf3693ca18d4fd42d8261a5fe2c50a8b0ccf5386f27047b8c582c8","evidence_refs":[{"column":"pump","file_sha256":"423f079bf9bd6041f1c762f62ecf68398013874f7102811b2917a3d52f420e31","frame_number":null,"raw_time":"2026-01-01T00:00:09Z","record_number":1}],"id":"913f233311cf3693ca18d4fd42d8261a5fe2c50a8b0ccf5386f27047b8c582c8","kind":"process"},{"event_id":"666218055522e6220bd5e36903fe802df568bc24dccbfbb1624fffa605b60aac","evidence_refs":[{"column":"pump","file_sha256":"423f079bf9bd6041f1c762f62ecf68398013874f7102811b2917a3d52f420e31","frame_number":null,"raw_time":"2026-01-01T00:00:10.500000Z","record_number":2}],"id":"666218055522e6220bd5e36903fe802df568bc24dccbfbb1624fffa605b60aac","kind":"process"},{"event_id":"59bdeb6c1d0a2662f34af8bcfd1dd661f1a11610e53b29fb1f2e3a23a258a3d9","evidence_refs":[{"column":"pump","file_sha256":"423f079bf9bd6041f1c762f62ecf68398013874f7102811b2917a3d52f420e31","frame_number":null,"raw_time":"2026-01-01T00:00:12Z","record_number":3}],"id":"59bdeb6c1d0a2662f34af8bcfd1dd661f1a11610e53b29fb1f2e3a23a258a3d9","kind":"process"},{"event_id":"8964b7f32742852eb6a6c6432c4ab66821896e43da4d1accf2cdbe76ccca25be","evidence_refs":[{"column":"pump","file_sha256":"423f079bf9bd6041f1c762f62ecf68398013874f7102811b2917a3d52f420e31","frame_number":null,"raw_time":"2026-01-01T00:00:15Z","record_number":4}],"id":"8964b7f32742852eb6a6c6432c4ab66821896e43da4d1accf2cdbe76ccca25be","kind":"process"},{"event_id":"32b9ff75cf230835ac103b33fc49f45a515134b0210182342ddeff091809fa3e","evidence_refs":[{"column":"pump","file_sha256":"423f079bf9bd6041f1c762f62ecf68398013874f7102811b2917a3d52f420e31","frame_number":null,"raw_time":"2026-01-01T00:00:16Z","record_number":5}],"id":"32b9ff75cf230835ac103b33fc49f45a515134b0210182342ddeff091809fa3e","kind":"process"},{"event_id":"change-67ee4da11f655149581cc5e85630e7c620ca7604e1818031707d18479908e429","evidence_refs":[{"column":"pump","file_sha256":"423f079bf9bd6041f1c762f62ecf68398013874f7102811b2917a3d52f420e31","frame_number":null,"raw_time":"2026-01-01T00:00:10.500000Z","record_number":2},{"column":"pump","file_sha256":"423f079bf9bd6041f1c762f62ecf68398013874f7102811b2917a3d52f420e31","frame_number":null,"raw_time":"2026-01-01T00:00:12Z","record_number":3}],"id":"change-67ee4da11f655149581cc5e85630e7c620ca7604e1818031707d18479908e429","kind":"derived_event"}],"schema_version":"1.0.0","statistics":{"edges":1,"nodes":8},"synthetic":true,"truncation":{"reason":null,"truncated":false}}
